id,canyon,description,analysisType,analysis
davis-creek-2016-06-24,Davis Creek,"I fell 40′ down a waterfall into the most dangerous hydraulic of Davis Canyon with a pack on my back and a bag clipped to my side. I’m writing this partly because I think it’ll be therapeutic but also because I hope people can learn something from it as well.

We went into Davis Canyon in the Pacific North West at extreme levels. This is a canyon I’d run 4 times prior (in high flow) gone first or last on all the dangerous sections, and was able to escape the potholes/hydraulics. There was at least 30-40% more water when we went in. The canyon has changed significantly since the last season – logs that were anchors had been flushed away, rappels are now jumps, logs used as footholds are buried 2 feet underneath the water, downclimbs became slides, and the swirling potholes weren’t just swirling, they were swirling and all white water. The last technical rappel is the most dangerous. It’s 80 feet and all the water lands in a hole about 3×4 wide (and very deep). Even in high flow, we normally rappel directly into the flow and land in the hydraulic and escape it. It’ll bob you up and down for a while…but with a couple good kicks and diving down, you can catch the current out. With the current flow, our group decided it would be safer to avoid this hydraulic. This required rappelling down some very slippery rock Down Canyon Right, crossing the waterfall, getting onto a ledge, traversing to a ledge, getting off rope and jumping 30 ft from the chaos. Once you start crossing the waterfall, you run the risk of penduluming. Two people had gone down before me. We needed to deploy the pull line so as to set up a guided rappel. The anchor is on a slippery slope Down Canyon Right and Luca had attached two rope bags to my side before I got on rappel. In order to get around him, I had to go below him and step over the rappel line (it was tensioned by the force of the water). As I started rappelling, I realized the lines were crossed and that some of the ropes had started to come out of the bag. I struggled to fix the issue as I was slipping on slippery rock, had problems pulling up the rope bags and moving them since they were getting pulled down by the water, and had problems lifting the rappel line since that too was getting pulled by the water. Luca saw the issue and told me to ascend back up. He thankfully made the call that I was too frazzled to deploy the two rope bags and instead gave me a bag to take down instead. With the bag clipped to my side and my own pack on me, I rappelled down a couple feet. I slipped, but no problem, I’ve done that before and got back up. Now I had to cross the slippery waterfall. Once you start crossing the waterfall, you are out of the fall line and risk penduluming. I could tell the pack on my side was getting pushed by the water and was throwing me off balance. When I crossed the waterfall, I slipped again. But this time, I was in the full force of the water, and I struggled and kicked to get back on my knees and feet. I should have locked off to free my hands to get myself upright, but I death gripped the rappel line with both hands below the descender. When I was back up on my feet, I was 2 feet away from a ledge; I took a step, and all I remember after that is that I was falling, being engulfed in water, having a tremendous amount of water pushing me down.

I hit a few things on the way down but before I knew it, I was deep inside a hydraulic and took a few good spins. I attempted to swim to the surface, but even with a few strides, I still wasn’t at the surface. I remember thinking “shit, I didn’t breathe before I landed.” I wanted to take a breath but still hadn’t broken the surface. I kept kicking and eventually made it to the surface. I remember feeling relieved but then immediately felt the pack at my side dragging me down. Immediately I knew I was not in a good situation but all I could think to do was to just keep my head above water so I could breathe. I tried swimming out but the pack kept pulling me back. The entire waterfall was also crashing down on my head. I just remember trying to swim out (more like flailing my arms) and suddenly I was getting pulled out.

Thor had thrown a rescue rope and though I had no clue that he had thrown it, I had somehow managed to grab it and Logan and Thor pulled me out. The first words out of my mouth (and I think I repeated it a few times) was: “I couldn’t get out, the pack kept pulling me down.” I luckily came out with a few bruises and a whole bunch of new things I’ve learned.",ICAD,"<ul><li>Minimal friction should be used to avoid inverting or entrapment. One must keep the body bent forward (not look up); tilting the head forward can provide a small pocket of breathable air, but if water flows are too dangerous, they should be avoided. Creative anchoring may be necessary to build rappel stations out of the flow of highly dangerous, fast<li>flowing, water sections.</li><li>A large surface area item such as a pack or rope bag can result in much more force acting on the rappeler. Packs and rope bags should be thrown, zipped or attached only over one shoulder while on rappel in moving water. Chest straps should be unbuckled, as should hip belts to ensure that packs can be jettisoned in the event of an emergency.</li><li>Attempts should be made to stay out of the stream of fast moving water. Slowly rappel in order to carefully place the feet, and keep a good rappelling posture to ensure proper balance and reduce angular forces on the wall to ensure maximum grip. The maximum friction your feet will provide is when you are perpendicular to the surface, with as much weight as possible in this vector.</li><li>Hydraulics can be very dangerous and in this unique case, flotation can be a danger rather than a help, as the key to escaping hydraulics is to get below the circulating current. Packs should be removed beforehand to ensure maximum swimming potential, and loose gear attached to the harness can get caught in cracks and trees in the water and should be secured as best as possible (eg. loose slings, open carabiners, etc).</li><li>In swift water, throw ropes can be life<li>saving safety devices. Ensure that the proper rope (floating) is used in the throw bag, that it is properly packed and ready for deployment, and that the thrower is trained and proficient in the use of throw ropes. Oftentimes, inexperienced rescuers throw the wrong (loose) end of the rescue rope, resulting in extremely poor effect. Swiftwater training courses will demonstrate how to properly throw rescue ropes, and additional training is highly recommended for those exploring more dangerous class C canyons.</li></ul>"
nobe-young-creek,Nobe Young Creek,"I was canyoneering in a little documented canyon in the eastern Sierra with two friends. We were wearing full wetsuits but there was very little water past the first rappel. I went ahead of the others to set the next rappel and sat down to slide a wet slab into a small pool of water. I had too much momentum and my left shoe hit bedrock on the other side of the pool, forcing the foot up toward the shin in extreme dorsiflexion. I thought hitting the water would slow me down more than it did.

There was a good deal of pain, but when I took my shoe off to examine the foot, there was no swelling or discoloration. I kept it in the cold water for a few minutes and wrapped it with self adhesive sports wrap, which provided great support. After the initial jolt, my foot was sore but I was able to complete the canyon and hike out two miles with minimal discomfort. Later that evening, it began to swell and throb. I had my foot x-rayed the next day and there was no damage to be seen, although I had sprained ligaments on both the inside and outside of my ankle. After several weeks with no improvement, I had a CT-scan, which revealed bone marrow edema and a bone bruise, which is similar to a fracture but with less damage to the bone. When my foot struck the rock, it moved in such a way that the end of the tibia knocked into the talus bone and crushed part of it.",Main,Toboggans often present hazards that cannot be assessed from above. The rock must be checked for irregularities where the person will slide. The landing zone needs to be investigated first by a person on rope to verify there are no hazards.
bear-creek-2016-08-13,Bear Creek Canyon,"A canyoneer was the first in her group to start down a rappel, but water flow pushed her so her finger was entrapped between her rope and the ledge, an overhang. With no footing or wall support, she was stuck directly in the water path and could not easily free her hand. She yanked her finger out from under the rope, feeling ""every bone break."" After rappelling a few feet further, her hair got stuck in her rappel device, and while she had an air pocket should could not easily access her rescue gear. She signaled for ""Emergency! Lower me!"" but the group above could not rig the pinched figure 8 to do so. With the help of a SAR teammate, the team was eventually able to convert to a haul system to lower her.",ICAD,"<p>Although rappelling may appear easy, it is a perishable skill that requires good judgement and forethought. Overhangs, lips, squeezes, and flowing water can make rappels especially complicated and difficult for less experienced rappelers. Thinner (and therefore faster) ropes can be startling toward the end of a long rappel. In general, hands should not be between the rope and the rock; a slip or loss of footing could cause entrapment of a hand or hair between the rope and rock, and could also cause the rappeler to let go of the rope. Overhangs are a common cause of this type of problem, and keeping the non-rappel hand off to the side and away from the rope and rock should be a conscious effort; it doesn’t hurt for the anchorman to give this reminder or other tips if conditions warrant it.<p></p>Those manning anchor stations should be cognizant of checking rappelers before they get on rope, and offer pertinent advice or information for the rappel as it is known, or as the first rappelers feeds information back to the anchorman. This communication is critical for enhancing safety, as the first rappeler should be more experienced, and therefore theoretically more capable, of identifying potential problems on the rappel for the rest of the team. Those manning anchor stations are also responsible for not only managing the anchor and rope, but also monitoring rappelers as they descend or overcome obstacles whenever possible, serving as a spotter. Thus, it is important to ensure that anchormen are not distracted with other tasks or unnecessary communication.Another important consideration with releasable anchors is the gap between theoretical and actual releasability. Releasable anchors should be, “reliably releasable and reachable.” Awkward anchor locations or poor placement/routing of the rope through a Figure 8, for example, can cause the rope or a Figure 8 to be pinched against the rock or anchor bolts when the system is loaded. Or, anchor locations can be difficult to reach or man safely such that manipulating the anchor can be difficult while ensuring team members can approach the anchor safely and get on rope. These considerations should be evaluated when placing bolts or anchors (as should the pull angle), bearing in mind that optimal anchor locations can vary with canyon conditions.<p></p>A test of releasability (and pullability) can be valuable and informative; the first rappeler can load the anchor, and the anchorman can evaluate the rappel angles, load distribution, and accessibility of the anchor to ensure that it will be releasable and reachable under load.<p></p>If a releasable system is not releasable under load during a test, slings can be used to extend the system away from the rock. Or, if the system is pinned, a cowstail can be used to clip to the figure 8, and body weight (from the anchorman or other team members) can be used to temporarily unjam the Figure 8 from the bolt or rock.<p></p>For rappelers, getting hair, gloves, pack straps, or gear stuck in a rappel device is always a risk; keep in mind that flowing water can move hair or other equipment out of “secure” locations and right into the rappel device. Buffs or bandanas can be useful tools for keeping hair out of the way, as hair ties and clips can get pulled off or break under the force of jumps or flowing water. Teammates should also be routinely checking each other to ensure that gear is managed properly and risks such as loose hair or straps are addressed; if anyone observes an unsafe condition, or a potentially unsafe condition, they are obligated to speak up and inform the rest of the team, as canyon descents are safest when everyone is looking out for everyone else.</p>"
bear-creek-2016-08-13,,,Main,"Whenever possible, embark on a rappel keeping your hands free from potential entrapment"
monmouth,Monmouth Creek,,,
keyhole-lake-mead,Keyhole,"A group of six canyoneers, including many beginners, got a stuck rope at the Third Waterfall rappel. The group leader ""Batmanned up the rope to free it,"" but suffered a 40' fall when the rope gave way, breaking his pelvis. Four group members were able to hike out while a fifth stayed with the injured man. SAR was on site and able to haul the man up the waterfall for rescue.",Main,"Attention to anchors, rigging, and rope placement is crucial to prevent stuck ropes. In the event of a stuck rope that is not blocked, one should not ascend the rope."
cerberus-2017-02-17,Cerberus,"According to a lengthy trip report posted on ropewiki, the injured person rappelled on a deadman anchor, fully inspected, of existing tan tubular Bluewater webbing. Many canyoneers descended the 2-stage rappel without incident with a meat anchor backing up the anchor. A long break between the 4th and 5th rappelier led the meat anchor to remove himself from the backup for a break. When the 5th person was descending there was no backup. They rappelled the first part of the drop, but when the rope was re-tensioned at the second drop the webbing snapped and the rappelier fell about 10 - 15 feet and landed on his back in wet sand. He was buffered by his pack, though he still sustained several breaks to his hand arm, and ribs. With assistance he was able to be lowered down the remaining 13 drops of the canyon. There is an extensive discussion of the webbing, which was strength tested after the incident, here: http://ropewiki.com/Incidents:Webbing_failure_in_Cerberus",Main,"All natural anchors need to be thoroughly inspected. It can be difficult to accurately judge the condition of webbing that is in place. Possible problems can be UV damage, animals chewing on it, and damage from moving rock and water. Replacing the older webbing with new may have prevented this incident."
muir-ravine-west-2017-03-11,Muir Ravine (West),"An experienced canyoneer rolled her ankle, resulting in a broken tibia. According to her group: ""This occurred near the half way mark in Muir due to loose rock. She was able finish with assistance to carry on through lower Eaton and hike out.""",Main,Loose rock poses hazards both in wet and dry canyons.
monkeyface-2017-03-18,Monkeyface Falls,"According to the report, on the last rappel;  ""The team memberI set the rope and proceeded to descend at a 75 degree slope . It was half dry and half mossy. The team member advanced about 10' trying to stay on the high and dry side but the rope kept wanting to go the natural way with gravity. As they where adjusting they stepped to their right and one foot got on the moss and thats when they lost control, swung over and their knee hit one rock and got lodged in another and twisted.""",Main,"It is unclear why the rappeller wanted to avoid the fall line. Generally speaking, it is best to stay in the fall line whenever possible to avoid creating the potential for a pendulum fall."
hades-2017-04-13,Hades,"A group of three canyoneers attempted to descend Hades Canyon, well-prepared with research and gear. One of the canyoneers lost control of his descent while rappelling and fell 40 feet. His teammates were able to asses his injuries which prevented him from completing the canyon. They left him with sufficient supplies and continued through the canyon (including an overnight bivy) to call for help while he waited.",Main,"Fortunately, this team was prepared to spend the night in the canyon. Consider carrying an emergency signaling device such as a personal locator beacon and/or satellite messenger."
heaps,Heaps Canyon,"I descended Heaps canyon with four friends. I have descended it twice before. I was the only one of the five of us who had done the canyon. My friends were all advanced canyoneers. Weather was clear. Over the years, I have had many discussions about the final corridor, up climb and final rappel sequence. I tend to run cold. So, for Imlay and Heaps I have always used a drysuit. I did so this time. My drysuit functioned perfectly in a swimming pool a few months ago. Not so this time. Once I was into the deep, dark, cold, wet section; I felt water entering at the level of the pee zip. I stopped, took off my harness and operated the zipper back and forth a few times. There was no obvious problem. However, I would discover the next morning that the end stop for the zipper had become separated from the drysuit. This resulted in a toothpick sized hole that let water in. The defect was not visible to me while I was wearing it.  It was worse when I swam. As the canyon progressed, I was getting increasingly wet and cold. In the sections that involved a lot of movement out of water, I felt fine. In the water, I was not. I mentioned twice to one of my friends that I was cold. A few minutes later the group asked me if I should stop and warm up. The location they chose on canyon left did not look inviting. Hence, we continued for a few minutes. They asked again. This time the location looked reasonable. I climbed up a short distance above the water and sat down. The next think I knew, I was sitting with a space blanket wrapped around me and an emergency candle between my legs. That felt great! My friends built a small fire and coaxed me to leave the candle. I slept for a while. Lovely hard rock mattress. I think there must be a mathematical equation that describes the longer a person lays on a rock, the harder it gets. Over the next few days I became aware of what had happened as my friends gave me bits and pieces of information. After I sat down, I became incoherent. They had to fight me to get my wet clothes off. They feared I might die of hypothermia. One of the individuals who stayed with me had experience with death, hence he and another got to share the hard rock bed. Two others finished the canyon and called for rescue.
 
As the sun came up, I closely examined my drysuit, discovering the problem. Duct tape would easily make an emergency repair. We considered finishing the canyon. However, we knew the rescue team had the GPS waypoint of our location. So we waited. After three flybys of the helicopter and a few hours of deliberation, two rescuers descended from the rim to our location. The plan was for all five of us to finish the canyon. They each brought 300 feet of 11 mm rope. Neither had done any canyoneering. Neither had ever been in Heaps before. Off we went. Eventually we got to the end of the final corridor. There was a blue webbing anchor tied around a log on canyon left. I backed it up while the other four descended 60-ish feet. Now they were looking down the 500 feet to Emerald Pools. Opps, I had misdirected them! However, they discovered that my two friends the day before had also gone this way. They had tied together 500 feet of rope and descended, leaving it attached to the anchor. While the two rescuers and my two friends were in the exit slot, I did the standard climb up the usual exit route. My apologies were clearly not enough. The four had to ascend back up. One of the rescuers would not allow my friends to untie our 500 feet of rope. We finished Heaps in the usual way using one shorter canyon rope plus the two 11 mm ropes.
 
Once the ropes were pulled and people were leaving the Emerald Pools, one rescuer took down my name, etc. He asked with hindsight did I think the rescue was needed. I gave a rather convoluted answer.  When I was hypothermic and incoherent, my friends decided that rescue was needed. But then I warmed up and discovered the cause of the leaky but fixable drysuit. At that point no rescue was needed. However, we had no way to communicate that until the rescuers arrived. But if the three of us would have exited the canyon without the rescuers on the usual route, we would have discovered there was no rope. At that point rescue would have been needed (or at least we would have needed 500 feet of rope). Perhaps we would have figured out that our two friends the day before had taken the other exit route.",Main,"<p>Drysuits can fail. As in this case, even being prepared with repair material may not be enough. The cause of the leak was not obvious. Consequently wearing a thin wetsuit inside the drysuit may mitigate the cold and prevent a disaster. Other thermal concerns such as extra warm, dry clothes and the ability to start a fire are important. Space blankets are a must.</p>
<p>The greatest concern is why I missed the usual exit up climb. I appreciate I had been hypothermic. That has some lingering effects physically and psychologically. I had little food or water for the previous 12 hours. I had little sleep. Most importantly there was the blue webbing around the log. It was like a huge magnet that pulled me to it. I developed tunnel vision on that anchor, ignoring what I knew about the canyon.</p>
<table>
<caption>Table: common signs and symptoms of hypothermia.</caption>
<tbody>
<tr>
<td>Stage</td>
<td>Core body temperature</td>
<td>Symptoms</td>
</tr>
<tr>
<td>Mild</td>
<td>90-95 °F<br>32-35 °C</td>
<td>Shivering; poor judgment; amnesia and apathy; increased heart rate; increased breathing; cold or pale skin</td>
</tr>
<tr>
<td>Moderate</td>
<td>80-90 °F<br>27-32 °C</td>
<td>Progressively decreasing levels of consciousness and stupor; shivering stops; decreased heart rate and breathing; decreased reflexes and no voluntary motion; paradoxical undressing</td>
</tr>
<tr>
<td>Severe</td>
<td>80 °F<br>27 °C</td>
<td>Low blood pressure and bradycardia; no reflexes; loss of consciousness; coma; death</td>
</tr>
</tbody>
</table>"
