id,canyon,description,analysisType,analysis
wallace-river-2017-08-21,Wallace River,"We had 5 people in our group. Three of us were very experienced. Three of us had done this canyon about 10 days prior. It was a beautiful sunny day. The day of the eclipse in fact. The person who fell, Nichole, had done one previous canyon and this was the 9th rappell of the day for Wallace River Canyon which was her second canyon. We bottom-belayed her for the first few rappells. After that, she communicated that she was solid, comfortable, and no longer needed to be belayed. We were now rappelling down a 300 foot waterfall that was broken up into three separate rappells with established anchors at the different stations. The experienced canyoneers sandwiched her between all of us for safety but there was really very little worry as her skills felt solid.
The accident occurred on the second stage (~110’) of the waterfall rappel. The first 40 feet or so Nichole used the wall in front of her to walk her feet down as she rappelled. The wall then dropped away and although we discussed and warned her that this would happen, she found herself in a free hanging rappel.
At that time, she lost her brake hand. It went over her head and she lost control of the rappel. She fell about 60 feet onto a ledge of boulders.
The person on the ground got to her immediately. The rest of us rapped down to her. We had Garmin inReach. Two of us are Trauma ICU nurses. We signaled for help using the SOS inReach. Nichole was badly injured and medically unstable.
Snohomish Search and Rescue was en route in less than 20 minutes; however, because of the logistics of the canyon, the narrow area we were in, etc. it ultimately took more than 4 hours to air lift her out of the canyon. The rescue involved about 75-100 ground and air rescue crew. Nichole spent time in the trauma ICU, the hospital, and about 3 months in a wheelchair. She has had additional surgeries but is walking and continues progressing towards the life that she had prior to the fall.",ICAD,"<p>Positional changes and movements tend to be inherently more dangerous than being static because system forces change and dynamics change when transitions occur. For instance, going over lips or edges, changing the angles of rappel mid rappel (to say, avoid an obstacle or deal with a problem), or moving from one rock in a stream to another changes how weights and forces are distributed on surfaces or anchors that hold us. Hands can get caught between rocks and ropes, or unexpected balance losses due to a moving rock or tensioned rope slipping off of an edge or obstacle can damage equipment and anchors, startle rappelers, and can lead to injuries.</p><p>Thus, “areas of transition” should be evaluated with a additional consideration, particularly when flowing water is involved (eg. going from no water flow to water flow, or areas where water flow dynamics change due to obstacles (eg. rooster tails, hydraulics, siphons, etc)). Overhangs and cracks for example, tend to be locations where rappel devices, hands, shoes, and ropes can get caught, or unlocked carabiners can pop open. Flowing water or heavy packs can cause inversions or loss of footing and control.</p><p>Anchor locations should be decided not just based on the strength of the anchor, but in a location that is easy and safe to initially access, easy to man, easy to pull from, easy to start a rappel on, and less likely to be damaged by fast moving water or flooding. Oftentimes, it is difficult or impossible to fulfill all of these criteria, so tradeoffs must be made and decisions to place anchors in a certain location must necessarily involve (and should consciously involve) a decision to increase risks in other categories.</p><p>Experience and comfort (part of mindset) play a big role in safety as well. Being “too experienced” and too comfortable can be just as dangerous, if not more dangerous, than being inexperienced and uncomfortable due to a lack of experience. It is important that regardless of the level of experience, we evaluate the situation with as fresh a pair of eyes as possible; many accidents or injuries occur “after we’ve done it before” or after “we’ve done it this way and have never had a problem.” We always need to be vigilant and cautious to be safe, and evaluate situations as they occur on that day at that time, even if we have significant prior experience.</p><p>Although one could say this incident happened partly because of inexperience or improper equipment, canyoneers need to be cognizant of the fact that this could happen to anyone, regardless of experience level. Canyoneering is an inherently dangerous activity, and no one is immune from making mistakes or having a problem; thus, safety measures and safety mindset should always be discussed and taken, contingencies should always be evaluated and prepared, and we should be prepared for the worst even though we hope and plan for the best. In this case, having the medical experience on hand and an Inreach may very well have been the difference between life and death.</p>"
wallace-river-2017-08-21,,,Main,We were rappelling into water and on a ledge so a bottom belay would have prevented the ultimate fall but probably not realistic in this situation. She was rappelling with an ATC so maybe a device with more resistance would have helped as well. An ATC was her rappel device that she was most comfortable with. More experience on free hanging rappelling would probably have better prepared her to control her descent. We have discussed this for hundreds of hours. If only…
abysmal-2017-08-24,Abysmal Canyon,"Person on rappel asked for a belay. Canyoneer giving the belay was positioned directly under the line of rappel, and was struck by rocks purportedly kicked loose by the person on rappel. The laceration exposed bone, and the injured person was able to apply first aid and complete the remaining 20 rappels, with her team lowering her down 17 of them.",Main,The individual doing the bottom belay needs to be in a position that avoids rock fall.
englestead-hollow-2017-09-03,Englestead Hollow,"On the morning of September 3, 2017, a 38 year old New Hampshire man died while rappelling on the first 300 foot entry rappel of Englestead Hollow in Zion National Park. According to a doctor who was with another canyoneering team at a nearby rappel station, and who was the first to respond to the injured man, the victim had to adjust something and instead of using his free hand, he took his break hand off the line. Being first man down, there was no fireman belay to capture him as he started dropping. He was unable to regain control and fell the last 80 feet of the 300 foot rappel. He smashed into rocks multiple times on his way down and suffered leg, hip and back injuries. A Department of Public Safety helicopter, which happened to be in nearby Garfield County at the time, was dispatched to the scene after another medical helicopter was unable to land at the canyon because of trees in the area. The DPS team, a nurse from the other helicopter, and a National Parks search and rescue team were eventually able to reach the fallen man but he died at the scene of internal bleeding. The victim was rappelling with an ATC on a brand new 8.3 mm Canyon Fire rope.

It is unknown how experienced he was in canyoneering.",Main,"p>A 300 foot rappel is not something to take casually. Everyone must be aware of and appreciate the importance of friction and how it acts upon a weighted rope on a long rappel. It’s not uncommon to be overly confident at the beginning of a long rappel as the weight of the rope itself acts as a fireman’s belay and can slow the descent. But as the descent continues and the rappeler get closer to the ground (i.e. less rope under or “belaying” you), friction diminishes and speed increases. An inability to add friction on the fly, can quickly lead to a loss of control. It seems that a number of factors contributed to this individual’s death:</p>
<ol>
<li>Being an Easterner, it is likely this man was not an experienced canyoneer. A route with a 300 foot rappel right out of the gate was perhaps not a good choice.</li>
<li>Beginner canyoneers should not be the first down a long rappel. That person can then provide a bottom belay for the others.</li>
<li>The rope was a brand new 8.3 mm rope. This is a small diameter and often slick resulting in a fast rappel. This is all the more reason to have an experienced person descend first.</li>
<li>In this case, the rappel device was an ATC. That makes adding friction on the fly difficult, but not impossible. A better choice for this particular route might have been a canyon-specific device such as a Pirana, CRITR or a Sqwurel, all of which enable adding or subtracting friction mid-rappel.</li>
<li>Having the knowledge to apply friction by other methods may have resulted in a different outcome. Some possible options with a tube device such as an ATC are:
	<ul>
	<li>using TWO locking carabiners side by side with the ATC to double the friction</li>
	<li>using another locking carabiner placed on the leg loop to thread the brake-hand rope through and be used as a “re-direct” to increase friction</li>
	<li>using an auto-block as a back-up in the event of releasing the brake hand, although auto-blocks can create some of their own unique problems.</li>
	</ul>
</li>
</ol>"
seven-tea-cups-2017-09-03,Seven Teacups,"According to a person at the incident, the water in the pool was about 3 feet deep. ""10 people out of our group jumped Ok. The person jumping next was a bigger guy and he landed bad, breaking his ankle. We had a wilderness first responder in our group who put a splint to his ankle. We sent out a group to call for help. 2 law enforcement officers came in and assessed the situation. They decided to call for an air extraction. While the helicopter was on its way it hit a thunderstorm and was forced to turn around. Another SAR party was sent in to stay with the patient during the night. He then was air lifted to a hospital in Visalia the following day.""",Main,All jumps should first be checked for water depth and underwater hazards by someone on rappel. Shallow or technical jumps with a small landing zone are particularly dangerous.
fish-creek-zig-zag-2017-12-17,Zigzag Canyon,"Two canyoneers descended and got their rope stuck 200 feet from the bottom of a 500+ foot wall. 

One canyoneer reported: ""I was able to rescue climb up about 75' above Kristy but here I was free hanging as the rock caved inwards and my top ascender was blocked by 9"" of a ledge that I can't get over. I couldn't get any leverage with my feet to try and pop my ascender over the ledge. Now I'm stuck tied onto my ascenders hanging there 500' above the ground and I can't go any higher because of the ledge but I can't go down because well, ascenders don't allow you to! Now I panic. I've gotta transfer to the other rope and if I undo one wrong connection, I fall to my death. I looped the rope through my belay on my harness, lock tied it around my thigh, and tried to figure out how to get off of my ascenders. I couldn't get any slack on the rope because of my weight so I had to cut away the slings that connected me to them and leave them there and pray I didn't drop. Cut. My thigh lock held and I was good. I unwrapped the rope from my leg and rappelled. Now we're back to square one. Anchored in and can't get our ropes down. ""  

He cut the ropes leaving him two pieces of 60' each, hoping to tie them together and complete the wall. Unfortunately at the next anchor he dropped them. 

Without the equipment to descend, they were forced to remain on a ledge until they were able to flag down a car passing on the road below. The SAR rescued them by helicopter and with a team. They waited on a ledge while temperatures dropped to 35 - 40 degrees by 11 pm when rescuers were able to reach them.",Main,"<ul><li>Each canyon requires a different amount of rope. In general a team should carry the equivalent of three times the longest rappel. However if there is only one long rappel, three times its length is not needed. Rather, great care must be taken to protect the rappel side of the rope for the long rappel in order to be able to retrieve it.</li><li>Having a beacon or other device to reach help is important in areas without cell phone reception.</li><li>All canyoneers need to be able to ascend and descend rope using some type of rope grabs. The equipment to do so must be on their harness. Often times all that is needed is unweighting the rappel device to overcome a jammed rope. Ascending over an overhang can be a difficult task without more advanced gear such as is used by cavers. Doing so requires a lot of practice.</li></ul>"
deimos-canyon-2018-02-17,Deimos Canyon,"A group of canyoneers of various experience levels (2 advanced, 4 intermediate, 1 beginner) were descending the canyon. Geoff was of larger stature and new to canyoneering and rappelling. He had successfully completed the first 2 shorter rappels of the canyon. On rappel 3, two intermediate canyoneers rappelled first, then continued to move down canyon, unbeknownst to the rest of the party. Geoff was using an ATC-XP for his rappel device and showed apprehension about having adequate friction on this longer (95’) rappel.

The team discussed whether he should use a different rappel device, or use an extra-friction setup like a leg loop carabiner re-direct or z-rig. It was decided that it would be unwise for him to try to learn new techniques on this longer rappel. The plan was for him to use the ATC-XP with 2 carabiners, a method of increasing the friction with this type of device. He struggled on the rappel and 1/3 of the way down he called for a belay, but lost control and fell 60 feet to the ground before the person on the bottom could run back and give a belay. His fall was softened by hitting a small ledge partway down and landing on backpack. He sustained contusions, small lacerations, abrasions, and swelling to the legs, arms, stomach, and head. There were no major or obvious injury reported. He was able to complete the canyon with no additional medical attention required, but was assisted on downclimbs and significant use of fireman belay on rappel.


Discussion about group dynamics: there was 1 expert, 1 advanced, 4 intermediate, 1 beginner. The accident occurred with the beginner on Rappel #3-95′. Geoff was approximately late 30’s male of larger stature and new to rappelling. Geoff was not known to the trip leader and a ‘friend of an intermediate friend’ described as being an avid hiker/backpacker, new to canyoneering. A friend thought Deimos would be a suitable canyon for this person. Geoff was nervous when he started the rappel, and the top team attempted to walk him through it to calm his nerves, but rappeler was out of eyesight quickly. It is unknown whether the rappeler truly did not have adequate friction or if it was a symptom of a newbie not trusting the gear, but Geoff was seen and heard to be exerting significant effort to rappel. About 30′ down rappel, Geoff is heard by the top party asking for a fireman belay urgently, with labored breathing. Intermediate group member at the bottom of the rappel attempted to run back to give belay, but could not reach the rope in time and observed the rappeler fall down the rope, bouncing off a small ledge on the way down and landing on his back on his backpack. Rappeler had let go of the rope in exhaustion from effort, possible due to lack of friction or perceived lack of friction. Rappeler suffered abrasions and swelling from the impact on the rock, but otherwise okay. Continued to complete the canyon with assistance on rappels via changing friction device and controlled fireman belay lowering.",Main,"<ul><li>The rappel device and method used must be suitable to a person’s size and stature.</li><li>If it is determined that a member is having significant difficulty with rappel device, it is generally not wize to try out new devices or techniques mid-canyon on difficult rappels. Instead, precautions should be taken to protect that member via belay.</li><li>Communication among group members concerning individuals having challenges is important.</li></ul>"
salmander,Salamander Canyon (aka Hot Spring Canyon),"<p>Two experienced canyoneers, Joy Welling and Casey Petersen, set out to run the canyon. Three and a half hours and 2.5 miles into the canyon, they reached Tanriverdi falls, 160’ waterfall. A 200’ Imlay Canyon Fire rope was rigged to the anchor with a figure 8 block. As Joy got on rappel, Casey said that he</p>
<q>watched and talked with her for the first 15-20 feet of her decent until I could not see her. I then walked away to grab my 200 foot rope to attach to the tail as a pull. She was on rappel for at least a minute or 2. At which point, I heard a clink and looked over and saw the rest of her rope go over the edge and heard her hit. My guess was that while shifting on the face of the falls, the 8 may have been caught on part of the rock, somehow releasing the 8. I have used this block technique and never seen it fail. I yelled for her, no response. I looked over the edge and could not see her. I checked to see if I had service, although it was slight I was able to call 911 knowing I would not have any service at the bottom of the falls. I spoke with dispatch and was able to quickly describe my position in relative to the mountain range and my coordinates, then lost signal. I went back to the ledge where I was able to clip into the webbing and lean over as far as I could where I saw her lying in the pool face down, unresponsive, no movement.</q>
<p>A helicopter was able to bring in a SAR team to rescue Casey and retrieve Joy.</p>",Main,"<ul><li>The figure 8 block is normally used in contingency rigging for flowing water conditions. The figure 8 block used in this accident was not set up for contingency; it was essentially being used as a static block.</li><li>The block failed when the rope somehow released through the figure 8 device. As with any static block, this failure mode can be mitigated by securing the tail and/or retrieval side of the rope to a suitable anchor.</li></ul>"
